Question,Answer,Difficulty
[Time series](#time-series),<br/>,
What is supervised machine learning?,"Supervised learning is a type of machine learning in which our algorithms are trained using well-labeled training data, and machines predict the output based on that data. Labeled data indicates that the input data has already been tagged with the appropriate output. Basically, it is the task of learning a function that maps the input set and returns an output. Some of its examples are: Linear Regression, Logistic Regression, KNN, etc.",easy
<br/>,## Linear regression,
What is regression? Which models can you use to solve a regression problem?,Regression is a part of supervised ML. Regression models investigate the relationship between a dependent (target) and independent variable (s) (predictor).,easy
Here are some common regression models,- *Linear Regression* establishes a linear relationship between target and predictor (s). It predicts a numeric value and has a shape of a straight line.,
- Lasso Regression penalizes the absolute values of regression coefficients and allows some of the coefficients to reach absolute zero (thereby allowing feature selection).,<br/>,
What is linear regression? When do we use it?,Linear regression is a model that assumes a linear relationship between the input variables (X) and the single output variable (y).,easy
With a simple equation:,```,
```,"B is regression coefficients, x values are the independent (explanatory) variables  and y is dependent variable.",
"The case of one explanatory variable is called simple linear regression. For more than one explanatory variable, the process is called multiple linear regression.",Simple linear regression:,
```,Multiple linear regression:,
```,<br/>,
What are the main assumptions of linear regression?,"There are several assumptions of linear regression. If any of them is violated, model predictions and interpretation may be worthless or misleading.",
"3. Errors are normally distributed, otherwise some features will have more influence on the target variable than to others. If the error distribution is significantly non-normal, confidence intervals may be too wide or too narrow.",<br/>,
What’s the normal distribution? Why do we care about it?,The normal distribution is a continuous probability distribution whose probability density function takes the following formula:,easy
![formula](https://mathworld.wolfram.com/images/equations/NormalDistribution/NumberedEquation1.gif),where μ is the mean and σ is the standard deviation of the distribution.,
"The normal distribution derives its importance from the Central Limit Theorem, which states that if we draw a large enough number of samples, their mean will follow a normal distribution regardless of the initial distribution of the sample, i.e the distribution of the mean of the samples is normal. It is important that each sample is independent from the other.",This is powerful because it helps us study processes whose population distribution is unknown to us.,
How do we check if a variable follows the normal distribution?,"1. Plot a histogram out of the sampled data. If you can fit the bell-shaped ""normal"" curve to the histogram, then the hypothesis that the underlying random variable follows the normal distribution can not be rejected.",medium
4. Check for Quantile-Quantile plot. It is a scatterplot created by plotting two sets of quantiles against one another. Normal Q-Q plot place the data points in a roughly straight line.,<br/>,
What if we want to build a model for predicting prices? Are prices distributed normally? Do we need to do any pre-processing for prices?,"Data is not normal. Specially, real-world datasets or uncleaned datasets always have certain skewness. Same goes for the price prediction. Price of houses or any other thing under consideration depends on a number of factors. So, there's a great chance of presence of some skewed values i.e outliers if we talk in data science terms.",medium
"Yes, you may need to do pre-processing. Most probably, you will need to remove the outliers to make your distribution near-to-normal.",<br/>,
What methods for solving linear regression do you know?,"To solve linear regression, you need to find the coefficients <img src=""https://render.githubusercontent.com/render/math?math=\beta""> which minimize the sum of squared errors.",medium
"Matrix Algebra method: Let's say you have `X`, a matrix of features, and `y`, a vector with the values you want to predict. After going through the matrix algebra and minimization problem, you get this solution: <img src=""https://render.githubusercontent.com/render/math?math=\beta = (X^{T}X)^{-1}X^{T}y"">.","But solving this requires you to find an inverse, which can be time-consuming, if not impossible. Luckily, there are methods like Singular Value Decomposition (SVD) or QR Decomposition that can reliably calculate this part <img src=""https://render.githubusercontent.com/render/math?math=(X^{T}X)^{-1}X^{T}""> (called the pseudo-inverse) without actually needing to find an inverse. The popular python ML library `sklearn` uses SVD to solve least squares.",
Alternative method: Gradient Descent. See explanation below.,<br/>,
What is gradient descent? How does it work?,"Gradient descent is an algorithm that uses calculus concept of gradient to try and reach local or global minima. It works by taking the negative of the gradient in a point of a given function, and updating that point repeatedly using the calculated negative gradient, until the algorithm reaches a local or global minimum, which will cause future iterations of the algorithm to return values that are equal or too close to the current point. It is widely used in machine learning applications.",medium
What is the normal equation?,Normal equations are equations obtained by setting equal to zero the partial derivatives of the sum of squared errors (least squares); normal equations allow one to estimate the parameters of a multiple linear regression.,medium
What is SGD  —  stochastic gradient descent? What’s the difference with the usual gradient descent?,"In both gradient descent (GD) and stochastic gradient descent (SGD), you update a set of parameters in an iterative manner to minimize an error function.",medium
"While in GD, you have to run through ALL the samples in your training set to do a single update for a parameter in a particular iteration, in SGD, on the other hand, you use ONLY ONE or SUBSET of training sample from your training set to do the update for a parameter in a particular iteration. If you use SUBSET, it is called Minibatch Stochastic gradient Descent.",<br/>,
Which metrics for evaluating regression models do you know?,1. Mean Squared Error(MSE),easy
5. Adjusted R²,<br/>,
What are MSE and RMSE?,MSE stands for <strong>M</strong>ean <strong>S</strong>quare <strong>E</strong>rror while RMSE stands for <strong>R</strong>oot <strong>M</strong>ean <strong>S</strong>quare <strong>E</strong>rror. They are metrics with which we can evaluate models.,easy
Bias-variance trade-off is a relationship between the expected test error and the variance and the bias - both contribute to the level of the test error and ideally should be as small as possible:,```,
```,"But as a model complexity increases, the bias decreases and the variance increases which leads to *overfitting*. And vice versa, model simplification helps to decrease the variance but it increases the bias which leads to *underfitting*.",
What is overfitting?,"When your model perform very well on your training set but can't generalize the test set, because it adjusted a lot to the training set.",easy
How to validate your models?,"One of the most common approaches is splitting data into train, validation and test parts.",easy
Also you could combine these approaches: make a test/holdout dataset and do cross-validation on the rest of the data. The final quality is measured on test dataset.,<br/>,
"Why do we need to split our data into three parts: train, validation, and test?","The training set is used to fit the model, i.e. to train the model with the data. The validation set is then used to provide an unbiased evaluation of a model while fine-tuning hyperparameters. This improves the generalization of the model. Finally, a test data set which the model has never ""seen"" before should be used for the final evaluation of the model. This allows for an unbiased evaluation of the model. The evaluation should never be performed on the same data that is used for training. Otherwise the model performance would not be representative.",easy
Can you explain how cross-validation works?,"Cross-validation is the process to separate your total training set into two subsets: training and validation set, and evaluate your model to choose the hyperparameters. But you do this process iteratively, selecting different training and validation set, in order to reduce the bias that you would have by selecting only one validation set.",easy
What is K-fold cross-validation?,"K fold cross validation is a method of cross validation where we select a hyperparameter k. The dataset is now divided into k parts. Now, we take the 1st part as validation set and remaining k-1 as training set. Then we take the 2nd part as validation set and remaining k-1 parts as training set. Like this, each part is used as validation set once and the remaining k-1 parts are taken together and used as training set.",easy
It should not be used in a time series data.,<br/>,
How do we choose K in K-fold cross-validation? What’s your favorite K?,"There are two things to consider while deciding K: the number of models we get and the size of validation set. We do not want the number of models to be too less, like 2 or 3. At least 4 models give a less biased decision on the metrics. On the other hand, we would want the dataset to be at least 20-25% of the entire data. So that at least a ratio of 3:1 between training and validation set is maintained. <br/>",easy
I tend to use 4 for small datasets and 5 for large ones as K.,<br/>,
What is classification? Which models would you use to solve a classification problem?,"Classification problems are problems in which our prediction space is discrete, i.e. there is a finite number of values the output variable can be. Some models which can be used to solve classification problems are: logistic regression, decision tree, random forests, multi-layer perceptron, one-vs-all, amongst others.",easy
What is logistic regression? When do we need to use it?,"Logistic regression is a Machine Learning algorithm that is used for binary classification. You should use logistic regression when your Y variable takes only two values, e.g. True and False, ""spam"" and ""not spam"", ""churn"" and ""not churn"" and so on. The variable is said to be a ""binary"" or ""dichotomous"".",easy
Is logistic regression a linear model? Why?,"Yes, Logistic Regression is considered a generalized linear model because the outcome always depends on the sum of the inputs and parameters. Or in other words, the output cannot depend on the product (or quotient, etc.) of its parameters.",easy
What is sigmoid? What does it do?,"A sigmoid function is a type of activation function, and more specifically defined as a squashing function. Squashing functions limit the output to a range between 0 and 1, making these functions useful in the prediction of probabilities.",easy
Sigmod(x) = 1/(1+e^{-x}),<br/>,
How do we evaluate classification models?,"Depending on the classification problem, we can use the following evaluation metrics:",easy
6. Jaccard similarity coefficient score,<br/>,
What is accuracy?,Accuracy is a metric for evaluating classification models. It is calculated by dividing the number of correct predictions by the number of total predictions.,easy
Is accuracy always a good metric?,"Accuracy is not a good performance metric when there is imbalance in the dataset. For example, in binary classification with 95% of A class and 5% of B class, a constant prediction of A class would have an accuracy of 95%. In case of imbalance dataset, we need to choose Precision, recall, or F1 Score depending on the problem we are trying to solve.",easy
What is the confusion table? What are the cells in this table?,"Confusion table (or confusion matrix) shows how many True positives (TP), True Negative (TN), False Positive (FP) and False Negative (FN) model has made.",easy
False Negative (FN): When the actual class of the observation is 1 (True) and the prediction is 0 (False),Most of the performance metrics for classification models are based on the values of the confusion matrix.,
"Max F score is 1 and min is 0, with 1 being the best.",<br/>,
Precision-recall trade-off,Tradeoff means increasing one parameter would lead to decreasing of other. Precision-recall tradeoff occur due to increasing one of the parameter(precision or recall) while keeping the model same.,medium
"In an ideal scenario where there is a perfectly separable data, both precision and recall can get maximum value of 1.0. But in most of the practical situations, there is noise in the dataset and the dataset is not perfectly separable. There might be some points of positive class closer to the negative class and vice versa. In such cases, shifting the decision boundary can either increase the precision or recall but not both. Increasing one parameter leads to decreasing of the other.",<br/>,
What is the ROC curve? When to use it?,ROC stands for *Receiver Operating Characteristics*. The diagrammatic representation that shows the contrast between true positive rate vs false positive rate. It is used when we need to predict the probability of the binary outcome.,medium
What is AUC (AU ROC)? When to use it?,"AUC stands for *Area Under the ROC Curve*. ROC is a probability curve and AUC represents degree or measure of separability. It's used when we need to value how much model is capable of distinguishing between classes.  The value is between 0 and 1, the higher the better.",medium
How to interpret the AU ROC score?,AUC score is the value of *Area Under the ROC Curve*.,medium
"If we assume ROC curve consists of dots, <img src=""https://render.githubusercontent.com/render/math?math=(x_1, y_1), (x_2, y_2), \cdots, (x_m,y_m)"">, then","<img src=""https://render.githubusercontent.com/render/math?math=AUC = \frac{1}{2} \sum_{i=1}^{m-1}(x_{i%2B1}-x_i)\cdot (y_i%2By_{i%2B1})"">",
"An excellent model has AUC near to the 1 which means it has good measure of separability. A poor model has AUC near to the 0 which means it has worst measure of separability. When AUC score is 0.5, it means model has no class separation capacity whatsoever.",<br/>,
What is the PR (precision-recall) curve?,A *precision*-*recall curve* (or PR Curve) is a plot of the precision (y-axis) and the recall (x-axis) for different probability thresholds. Precision-recall curves (PR curves) are recommended for highly skewed domains where ROC curves may provide an excessively optimistic view of the performance.,medium
What is the area under the PR curve? Is it a useful metric? I,"The Precision-Recall AUC is just like the ROC AUC, in that it summarizes the curve with a range of threshold values as a single score.",medium
"A high area under the curve represents both high recall and high precision, where high precision relates to a low false positive rate, and high recall relates to a low false negative rate.",<br/>,
In which cases AU PR is better than AU ROC?,What is different however is that AU ROC looks at a true positive rate TPR and false positive rate FPR while AU PR looks at positive predictive value PPV and true positive rate TPR.,medium
"Typically, if true negatives are not meaningful to the problem or you care more about the positive class, AU PR is typically going to be more useful; otherwise, If you care equally about the positive and negative class or your dataset is quite balanced, then going with AU ROC is a good idea.",<br/>,
What do we do with categorical variables?,"Categorical variables must be encoded before they can be used as features to train a machine learning model. There are various encoding techniques, including:",medium
- Target encoding,<br/>,
Why do we need one-hot encoding?,"If we simply encode categorical variables with a Label encoder, they become ordinal which can lead to undesirable consequences. In this case, linear models will treat category with id 4 as twice better than a category with id 2. One-hot encoding allows us to represent a categorical variable in a numerical vector space which ensures that vectors of each category have equal distances between each other. This approach is not suited for all situations, because by using it with categorical variables of high cardinality (e.g. customer id) we will encounter problems that come into play because of the curse of dimensionality.",medium
"What is ""curse of dimensionality""?","The curse of dimensionality is an issue that arises when working with high-dimensional data. It is often said that ""the curse of dimensionality"" is one of the main problems with machine learning. The curse of dimensionality refers to the fact that, as the number of dimensions (features) in a data set increases, the number of data points required to accurately learn the relationships between those features increases exponentially.",medium
"A simple example where we have a data set with two features, x1 and x2. If we want to learn the relationship between these two features, we need to have enough data points so that we can accurately estimate the parameters of that relationship. However, if we add a third feature, x3, then the number of data points required to accurately learn the relationships between all three features increases exponentially. This is because there are now more parameters to estimate, and the number of data points needed to accurately estimate those parameters increases exponentially with the number of parameters.","Simply put, the curse of dimensionality basically means that the error increases with the increase in the number of features.",
"What happens to our linear regression model if we have three columns in our data: x, y, z  —  and z is a sum of x and y?","We would not be able to perform the regression. Because z is linearly dependent on x and y so when performing the regression <img src=""https://render.githubusercontent.com/render/math?math={X}^{T}{X}""> would be a singular (not invertible) matrix.",medium
What happens to our linear regression model if the column z in the data is a sum of columns x and y and some random noise?,Answer here,medium
What is regularization? Why do we need it?,Regularization is used to reduce overfitting in machine learning models. It helps the models to generalize well and make them robust to outliers and noise in the data.,easy
Which regularization techniques do you know?,"There are mainly two types of regularization,",medium
"Where <img src=""https://render.githubusercontent.com/render/math?math=\lambda""> determines the amount of regularization.",<br/>,
What kind of regularization techniques are applicable to linear models?,"AIC/BIC, Ridge regression, Lasso, Elastic Net, Basis pursuit denoising, Rudin–Osher–Fatemi model (TV), Potts model, RLAD,",medium
"Dantzig Selector,SLOPE",<br/>,
How does L2 regularization look like in a linear model?,L2 regularization adds a penalty term to our cost function which is equal to the sum of squares of models coefficients multiplied by a lambda hyperparameter. This technique makes sure that the coefficients are close to zero and is widely used in cases when we have a lot of features that might correlate with each other.,medium
How do we select the right regularization parameters?,"Regularization parameters can be chosen using a grid search, for example https://scikit-learn.org/stable/modules/linear_model.html has one formula for the implementing for regularization, alpha in the formula mentioned can be found by doing a RandomSearch or a GridSearch on a set of values and selecting the alpha which gives the least cross validation or validation error.",easy
What’s the effect of L2 regularization on the weights of a linear model?,"L2 regularization penalizes larger weights more severely (due to the squared penalty term), which encourages weight values to decay toward zero.",medium
How L1 regularization looks like in a linear model?,"L1 regularization adds a penalty term to our cost function which is equal to the sum of modules of models coefficients multiplied by a lambda hyperparameter. For example, cost function with L1 regularization will look like: <img src=""https://render.githubusercontent.com/render/math?math=\sum_{i=0}^{N}%20(y_i%20-%20\sum_{j=0}^{M}%20x_{ij}%20*%20w_j)%2B\lambda\sum_{j=0}^{M}%20\left%20|%20w_j%20\right%20|"">",medium
What’s the difference between L2 and L1 regularization?,"- Penalty terms: L1 regularization uses the sum of the absolute values of the weights, while L2 regularization uses the sum of the weights squared.",medium
- Multicollinearity: L2 addresses multicollinearity by constraining the coefficient norm.,<br/>,
Can we have both L1 and L2 regularization components in a linear model?,"Yes, elastic net regularization combines L1 and L2 regularization.",medium
What’s the interpretation of the bias term in linear models?,"Bias is simply, a difference between predicted value and actual/true value. It can be interpreted as the distance from the average prediction and true value i.e. true value minus mean(predictions). But dont get confused between accuracy and bias.",medium
How do we interpret weights in linear models?,"Without normalizing weights or variables, if you increase the corresponding predictor by one unit, the coefficient represents on average how much the output changes. By the way, this interpretation still works for logistic regression - if you increase the corresponding predictor by one unit, the weight represents the change in the log of the odds.",medium
"If the variables are normalized, we can interpret weights in linear models like the importance of this variable in the predicted result.",<br/>,
If a weight for one variable is higher than for another  —  can we say that this variable is more important?,Yes - if your predictor variables are normalized.,medium
"Without normalization, the weight represents the change in the output per unit change in the predictor. If you have a predictor with a huge range and scale that is used to predict an output with a very small range - for example, using each nation's GDP to predict maternal mortality rates - your coefficient should be very small. That does not necessarily mean that this predictor variable is not important compared to the others.",<br/>,
When do we need to perform feature normalization for linear models? When it’s okay not to do it?,Feature normalization is necessary for L1 and L2 regularizations. The idea of both methods is to penalize all the features relatively equally. This can't be done effectively if every feature is scaled differently.,medium
"Linear regression without regularization techniques can be used without feature normalization. Also, regularization can help to make the analytical solution more stable, — it adds the regularization matrix to the feature matrix before inverting it.",<br/>,
What is feature selection? Why do we need it?,Feature Selection is a method used to select the relevant features for the model to train on. We need feature selection to remove the irrelevant features which leads the model to under-perform.,easy
Is feature selection important for linear models?,"Yes, It is. It can make model performance better through selecting the most importance features and remove irrelevant features in order to make a prediction and it can also avoid overfitting, underfitting and bias-variance tradeoff.",medium
Which feature selection techniques do you know?,Here are some of the feature selections:,medium
- ReliefF Algorithm,<br/>,
Can we use L1 regularization for feature selection?,"Yes, because the nature of L1 regularization will lead to sparse coefficients of features. Feature selection can be done by keeping only features with non-zero coefficients.",medium
Can we use L2 regularization for feature selection?,"No, Because L2 regularization does not make the weights zero but only makes them very very small. L2 regularization can be used to solve multicollinearity since it stabilizes the model.",medium
What are the decision trees?,"This is a type of supervised learning algorithm that is mostly used for classification problems. Surprisingly, it works for both categorical and continuous dependent variables.",easy
"In this algorithm, we split the population into two or more homogeneous sets. This is done based on most significant attributes/ independent variables to make as distinct groups as possible.","A decision tree is a flowchart-like tree structure, where each internal node (non-leaf node) denotes a test on an attribute, each branch represents an outcome of the test, and each leaf node (or terminal node) holds a value for the target variable.",
"Various techniques : like Gini, Information Gain, Chi-square, entropy.",<br/>,
How do we train decision trees?,1. Start at the root node.,medium
"3. If a stopping criterion is reached, exit. Otherwise, apply step 2 to each child node in turn.",<br/>,
impurity criterion,<br/>,
How do we handle categorical variables in decision trees?,"Some decision tree algorithms can handle categorical variables out of the box, others cannot. However, we can transform categorical variables, e.g. with a binary or a one-hot encoder.",medium
good explainability,<br/>,
