Question,Answer,Difficulty
What is precision and recall at k?,Precision at k and recall at k are evaluation metrics for ranking algorithms. Precision at k shows the share of relevant items in the first *k* results of the ranking algorithm. And Recall at k indicates the share of relevant items returned in top *k* results out of all correct answers for a given query.,medium
Recall at 5 = # num of relevant products in search result / # num of all relevant products = 2/3 = 66.6%,<br/>,
What is mean average precision at k?,Answer here,medium
How can we use machine learning for search?,Answer here,medium
How can we get training data for our ranking algorithms?,Answer here,medium
Can we formulate the search problem as a classification problem? How?,Answer here,medium
How can we use clicks data as the training data for ranking algorithms?,Answer here,expert
Do you know how to use gradient boosting trees for ranking?,Answer here,expert
How do you do an online evaluation of a new ranking algorithm?,Answer here,medium
What is a recommender system?,Recommender systems are software tools and techniques that provide suggestions for items that are most likely of interest to a particular user.,easy
A user should explore new items.,<br/>,
"Collaborative filtering does only need a rating matrix as input and improves over time. However, it does not work well on sparse data, does not work for cold starts (see below) and usually tends to overfit.",<br/>,
"How we can incorporate implicit feedback (clicks, etc) into our recommender systems?","In comparison to explicit feedback, implicit feedback datasets lack negative examples. For example, explicit feedback can be a positive or a negative rating, but implicit feedback may be the number of purchases or clicks. One popular approach to solve this problem is named weighted alternating least squares (wALS) [Hu, Y., Koren, Y., & Volinsky, C. (2008, December). Collaborative filtering for implicit feedback datasets. In Data Mining, 2008. ICDM'08. Eighth IEEE International Conference on (pp. 263-272). IEEE.]. Instead of modeling the rating matrix directly, the numbers (e.g. amount of clicks) describe the strength in observations of user actions. The model tries to find latent factors that can be used to predict the expected preference of a user for an item.",medium
What is the cold start problem?,"Collaborative filterung incorporates crowd knowledge to give recommendations for certain items. Say we want to recommend how much a user will like an item, we then will calculate the score using the recommendations of other users for this certain item. We can distinguish between two different ways of a cold start problem now. First, if there is a new item that has not been rated yet, we cannot give any recommendation. Also, when there is a new user, we cannot calculate a similarity to any other user.",medium
Demographic filtering incorporates user profiles to calculate a similarity between them and solves the cold start problem for new users.,<br/>,
What is a time series?,A time series is a set of observations ordered in time usually collected at regular intervals.,easy
How is time series different from the usual regression problem?,"The principle behind causal forecasting is that the value that has to be predicted is dependant on the input features (causal factors). In time series forecasting, the to be predicted value is expected to follow a certain pattern over time.",easy
"Deep learning approaches (RNN, LSTM, etc.)",<br/>,
"If there’s a trend in our series, how we can remove it? And why would we want to do it?","We can explicitly model the trend (and/or seasonality) with approaches such as Holt's Method or Holt-Winter's Method. We want to explicitly model the trend to reach the stationarity property for the data. Many time series approaches require stationarity. Without stationarity,the interpretation of the results of these analyses is problematic [Manuca, Radu & Savit, Robert. (1996). Stationarity and nonstationarity in time series analysis. Physica D: Nonlinear Phenomena. 99. 134-161. 10.1016/S0167-2789(96)00139-X. ].",medium
You have a series with only one variable “y” measured at time t. How do predict “y” at time t+1? Which approaches would you use?,We want to look at the correlation between different observations of y. This measure of correlation is called autocorrelation. Autoregressive models are multiple regression models where the time-lag series of the original time series are treated like multiple independent variables.,medium
You have a series with a variable “y” and a set of features. How do you predict “y” at t+1? Which approaches would you use?,"Given the assumption that the set of features gives a meaningful causation to y, a causal forecasting approach such as linear regression or multiple nonlinear regression might be useful. In case there is a lot of data and the explainability of the results is not a high priority, we can also consider deep learning approaches.",medium
What are the problems with using trees for solving time series problems?,Random Forest models are not able to extrapolate time series data and understand increasing/decreasing trends. It will provide us with average data points if the validation data has values greater than the training data points.,medium
